{
  "requestId": "oic-run-20260525-002",
  "source": {
    "system": "OIC",
    "integrationName": "StockAlertIntegration",
    "instanceId": "300000123456790"
  },
  "symbol": "ORCL",
  "rules": [
    {
      "ruleId": "orcl-above-200",
      "metric": "lastPrice",
      "operator": "gte",
      "threshold": 200.0,
      "severity": "high",
      "message": "ORCL crossed target price"
    }
  ]
}
